{
  "$schema": "https://ui.shadcn.com/schema/registry-item.json",
  "name": "toggle",
  "files": [
    {
      "path": "registry/base-mira/ui/toggle.tsx",
      "content": "\"use client\"\n\nimport { Toggle as TogglePrimitive } from \"@base-ui/react/toggle\"\nimport { cva, type VariantProps } from \"class-variance-authority\"\n\nimport { cn } from \"@/registry/base-mira/lib/utils\"\n\nconst toggleVariants = cva(\n  \"group/toggle inline-flex items-center justify-center gap-1 rounded-md text-xs font-medium whitespace-nowrap transition-all outline-none hover:bg-muted hover:text-foreground focus-visible:border-ring focus-visible:ring-[3px] focus-visible:ring-ring/50 disabled:pointer-events-none disabled:opacity-50 aria-invalid:border-destructive aria-invalid:ring-destructive/20 aria-pressed:bg-muted data-[state=on]:bg-muted dark:aria-invalid:ring-destructive/40 [&_svg]:pointer-events-none [&_svg]:shrink-0 [&_svg:not([class*='size-'])]:size-3.5\",\n  {\n    variants: {\n      variant: {\n        default: \"bg-transparent\",\n        outline: \"border border-input bg-transparent hover:bg-muted\",\n      },\n      size: {\n        default: \"h-7 min-w-7 px-2\",\n        sm: \"h-6 min-w-6 rounded-[min(var(--radius-md),8px)] px-1.5 text-[0.625rem] [&_svg:not([class*='size-'])]:size-3\",\n        lg: \"h-8 min-w-8 px-2\",\n      },\n    },\n    defaultVariants: {\n      variant: \"default\",\n      size: \"default\",\n    },\n  }\n)\n\nfunction Toggle({\n  className,\n  variant = \"default\",\n  size = \"default\",\n  ...props\n}: TogglePrimitive.Props & VariantProps<typeof toggleVariants>) {\n  return (\n    <TogglePrimitive\n      data-slot=\"toggle\"\n      className={cn(toggleVariants({ variant, size, className }))}\n      {...props}\n    />\n  )\n}\n\nexport { Toggle, toggleVariants }\n",
      "type": "registry:ui"
    }
  ],
  "meta": {
    "links": {
      "docs": "https://ui.shadcn.com/docs/components/base/toggle",
      "examples": "https://raw.githubusercontent.com/shadcn-ui/ui/refs/heads/main/apps/v4/registry/bases/base/examples/toggle-example.tsx",
      "api": "https://base-ui.com/react/components/toggle.md"
    }
  },
  "type": "registry:ui"
}