{
  "$schema": "https://ui.shadcn.com/schema/registry-item.json",
  "name": "direction",
  "dependencies": [
    "@base-ui/react"
  ],
  "files": [
    {
      "path": "registry/base-maia/ui/direction.tsx",
      "content": "\"use client\"\n\nexport {\n  DirectionProvider,\n  useDirection,\n} from \"@base-ui/react/direction-provider\"\n",
      "type": "registry:ui"
    }
  ],
  "meta": {
    "links": {
      "docs": "https://ui.shadcn.com/docs/components/base/direction",
      "api": "https://base-ui.com/react/utils/direction-provider.md"
    }
  },
  "type": "registry:ui"
}