{
  "$schema": "https://ui.shadcn.com/schema/registry-item.json",
  "name": "spinner",
  "files": [
    {
      "path": "registry/base-lyra/ui/spinner.tsx",
      "content": "import { cn } from \"@/registry/base-lyra/lib/utils\"\nimport { IconPlaceholder } from \"@/app/(create)/components/icon-placeholder\"\n\nfunction Spinner({ className, ...props }: React.ComponentProps<\"svg\">) {\n  return (\n    <IconPlaceholder\n      lucide=\"Loader2Icon\"\n      tabler=\"IconLoader\"\n      hugeicons=\"Loading03Icon\"\n      phosphor=\"SpinnerIcon\"\n      remixicon=\"RiLoaderLine\"\n      role=\"status\"\n      aria-label=\"Loading\"\n      className={cn(\"size-4 animate-spin\", className)}\n      {...props}\n    />\n  )\n}\n\nexport { Spinner }\n",
      "type": "registry:ui"
    }
  ],
  "meta": {
    "links": {
      "docs": "https://ui.shadcn.com/docs/components/base/spinner",
      "examples": "https://raw.githubusercontent.com/shadcn-ui/ui/refs/heads/main/apps/v4/registry/bases/base/examples/spinner-example.tsx"
    }
  },
  "type": "registry:ui"
}