{
  "$schema": "https://ui.shadcn.com/schema/registry-item.json",
  "name": "font-heading-montserrat",
  "title": "Montserrat (Heading)",
  "type": "registry:font",
  "font": {
    "family": "'Montserrat Variable', sans-serif",
    "provider": "google",
    "import": "Montserrat",
    "variable": "--font-heading",
    "subsets": [
      "latin"
    ],
    "dependency": "@fontsource-variable/montserrat"
  }
}