{
  "$schema": "https://ui.shadcn.com/schema/registry-item.json",
  "name": "progress",
  "files": [
    {
      "path": "registry/radix-nova/ui/progress.tsx",
      "content": "\"use client\"\n\nimport * as React from \"react\"\nimport { Progress as ProgressPrimitive } from \"radix-ui\"\n\nimport { cn } from \"@/registry/radix-nova/lib/utils\"\n\nfunction Progress({\n  className,\n  value,\n  ...props\n}: React.ComponentProps<typeof ProgressPrimitive.Root>) {\n  return (\n    <ProgressPrimitive.Root\n      data-slot=\"progress\"\n      className={cn(\n        \"relative flex h-1 w-full items-center overflow-x-hidden rounded-full bg-muted\",\n        className\n      )}\n      {...props}\n    >\n      <ProgressPrimitive.Indicator\n        data-slot=\"progress-indicator\"\n        className=\"size-full flex-1 bg-primary transition-all\"\n        style={{ transform: `translateX(-${100 - (value || 0)}%)` }}\n      />\n    </ProgressPrimitive.Root>\n  )\n}\n\nexport { Progress }\n",
      "type": "registry:ui"
    }
  ],
  "meta": {
    "links": {
      "docs": "https://ui.shadcn.com/docs/components/radix/progress",
      "examples": "https://raw.githubusercontent.com/shadcn-ui/ui/refs/heads/main/apps/v4/registry/bases/radix/examples/progress-example.tsx",
      "api": "https://www.radix-ui.com/docs/primitives/components/progress.md"
    }
  },
  "type": "registry:ui"
}