{
  "$schema": "https://ui.shadcn.com/schema/registry-item.json",
  "name": "input-otp",
  "dependencies": [
    "input-otp"
  ],
  "files": [
    {
      "path": "registry/radix-nova/ui/input-otp.tsx",
      "content": "\"use client\"\n\nimport * as React from \"react\"\nimport { OTPInput, OTPInputContext } from \"input-otp\"\n\nimport { cn } from \"@/registry/radix-nova/lib/utils\"\nimport { IconPlaceholder } from \"@/app/(create)/components/icon-placeholder\"\n\nfunction InputOTP({\n  className,\n  containerClassName,\n  ...props\n}: React.ComponentProps<typeof OTPInput> & {\n  containerClassName?: string\n}) {\n  return (\n    <OTPInput\n      data-slot=\"input-otp\"\n      containerClassName={cn(\n        \"cn-input-otp flex items-center has-disabled:opacity-50\",\n        containerClassName\n      )}\n      spellCheck={false}\n      className={cn(\"disabled:cursor-not-allowed\", className)}\n      {...props}\n    />\n  )\n}\n\nfunction InputOTPGroup({ className, ...props }: React.ComponentProps<\"div\">) {\n  return (\n    <div\n      data-slot=\"input-otp-group\"\n      className={cn(\n        \"flex items-center rounded-lg has-aria-invalid:border-destructive has-aria-invalid:ring-3 has-aria-invalid:ring-destructive/20 dark:has-aria-invalid:ring-destructive/40\",\n        className\n      )}\n      {...props}\n    />\n  )\n}\n\nfunction InputOTPSlot({\n  index,\n  className,\n  ...props\n}: React.ComponentProps<\"div\"> & {\n  index: number\n}) {\n  const inputOTPContext = React.useContext(OTPInputContext)\n  const { char, hasFakeCaret, isActive } = inputOTPContext?.slots[index] ?? {}\n\n  return (\n    <div\n      data-slot=\"input-otp-slot\"\n      data-active={isActive}\n      className={cn(\n        \"relative flex size-8 items-center justify-center border-y border-r border-input text-sm transition-all outline-none first:rounded-l-lg first:border-l last:rounded-r-lg aria-invalid:border-destructive data-[active=true]:z-10 data-[active=true]:border-ring data-[active=true]:ring-3 data-[active=true]:ring-ring/50 data-[active=true]:aria-invalid:border-destructive data-[active=true]:aria-invalid:ring-destructive/20 dark:bg-input/30 dark:data-[active=true]:aria-invalid:ring-destructive/40\",\n        className\n      )}\n      {...props}\n    >\n      {char}\n      {hasFakeCaret && (\n        <div className=\"pointer-events-none absolute inset-0 flex items-center justify-center\">\n          <div className=\"h-4 w-px animate-caret-blink bg-foreground duration-1000\" />\n        </div>\n      )}\n    </div>\n  )\n}\n\nfunction InputOTPSeparator({ ...props }: React.ComponentProps<\"div\">) {\n  return (\n    <div\n      data-slot=\"input-otp-separator\"\n      className=\"flex items-center [&_svg:not([class*='size-'])]:size-4\"\n      role=\"separator\"\n      {...props}\n    >\n      <IconPlaceholder\n        lucide=\"MinusIcon\"\n        tabler=\"IconMinus\"\n        hugeicons=\"MinusSignIcon\"\n        phosphor=\"MinusIcon\"\n        remixicon=\"RiSubtractLine\"\n      />\n    </div>\n  )\n}\n\nexport { InputOTP, InputOTPGroup, InputOTPSlot, InputOTPSeparator }\n",
      "type": "registry:ui"
    }
  ],
  "meta": {
    "links": {
      "docs": "https://ui.shadcn.com/docs/components/radix/input-otp",
      "examples": "https://raw.githubusercontent.com/shadcn-ui/ui/refs/heads/main/apps/v4/registry/bases/radix/examples/input-otp-example.tsx",
      "api": "https://input-otp.rodz.dev"
    }
  },
  "type": "registry:ui"
}