{
  "$schema": "https://ui.shadcn.com/schema/registry-item.json",
  "name": "button-group",
  "registryDependencies": [
    "separator"
  ],
  "files": [
    {
      "path": "registry/base-mira/ui/button-group.tsx",
      "content": "import { mergeProps } from \"@base-ui/react/merge-props\"\nimport { useRender } from \"@base-ui/react/use-render\"\nimport { cva, type VariantProps } from \"class-variance-authority\"\n\nimport { cn } from \"@/registry/base-mira/lib/utils\"\nimport { Separator } from \"@/registry/base-mira/ui/separator\"\n\nconst buttonGroupVariants = cva(\n  \"flex w-fit items-stretch *:focus-visible:relative *:focus-visible:z-10 has-[>[data-slot=button-group]]:gap-2 has-[select[aria-hidden=true]:last-child]:[&>[data-slot=select-trigger]:last-of-type]:rounded-r-md [&>[data-slot=select-trigger]:not([class*='w-'])]:w-fit [&>input]:flex-1\",\n  {\n    variants: {\n      orientation: {\n        horizontal:\n          \"*:data-slot:rounded-r-none [&>[data-slot]:not(:has(~[data-slot]))]:rounded-r-md! [&>[data-slot]~[data-slot]]:rounded-l-none [&>[data-slot]~[data-slot]]:border-l-0\",\n        vertical:\n          \"flex-col *:data-slot:rounded-b-none [&>[data-slot]:not(:has(~[data-slot]))]:rounded-b-md! [&>[data-slot]~[data-slot]]:rounded-t-none [&>[data-slot]~[data-slot]]:border-t-0\",\n      },\n    },\n    defaultVariants: {\n      orientation: \"horizontal\",\n    },\n  }\n)\n\nfunction ButtonGroup({\n  className,\n  orientation,\n  ...props\n}: React.ComponentProps<\"div\"> & VariantProps<typeof buttonGroupVariants>) {\n  return (\n    <div\n      role=\"group\"\n      data-slot=\"button-group\"\n      data-orientation={orientation}\n      className={cn(buttonGroupVariants({ orientation }), className)}\n      {...props}\n    />\n  )\n}\n\nfunction ButtonGroupText({\n  className,\n  render,\n  ...props\n}: useRender.ComponentProps<\"div\">) {\n  return useRender({\n    defaultTagName: \"div\",\n    props: mergeProps<\"div\">(\n      {\n        className: cn(\n          \"flex items-center gap-2 rounded-md border bg-muted px-2.5 text-xs/relaxed font-medium [&_svg]:pointer-events-none [&_svg:not([class*='size-'])]:size-4\",\n          className\n        ),\n      },\n      props\n    ),\n    render,\n    state: {\n      slot: \"button-group-text\",\n    },\n  })\n}\n\nfunction ButtonGroupSeparator({\n  className,\n  orientation = \"vertical\",\n  ...props\n}: React.ComponentProps<typeof Separator>) {\n  return (\n    <Separator\n      data-slot=\"button-group-separator\"\n      orientation={orientation}\n      className={cn(\n        \"relative self-stretch bg-input data-horizontal:mx-px data-horizontal:w-auto data-vertical:my-px data-vertical:h-auto\",\n        className\n      )}\n      {...props}\n    />\n  )\n}\n\nexport {\n  ButtonGroup,\n  ButtonGroupSeparator,\n  ButtonGroupText,\n  buttonGroupVariants,\n}\n",
      "type": "registry:ui"
    }
  ],
  "meta": {
    "links": {
      "docs": "https://ui.shadcn.com/docs/components/base/button-group",
      "examples": "https://raw.githubusercontent.com/shadcn-ui/ui/refs/heads/main/apps/v4/registry/bases/base/examples/button-group-example.tsx"
    }
  },
  "type": "registry:ui"
}