{
  "$schema": "https://ui.shadcn.com/schema/registry-item.json",
  "name": "alert-dialog",
  "registryDependencies": [
    "button"
  ],
  "files": [
    {
      "path": "registry/base-nova/ui/alert-dialog.tsx",
      "content": "\"use client\"\n\nimport * as React from \"react\"\nimport { AlertDialog as AlertDialogPrimitive } from \"@base-ui/react/alert-dialog\"\n\nimport { cn } from \"@/registry/base-nova/lib/utils\"\nimport { Button } from \"@/registry/base-nova/ui/button\"\n\nfunction AlertDialog({ ...props }: AlertDialogPrimitive.Root.Props) {\n  return <AlertDialogPrimitive.Root data-slot=\"alert-dialog\" {...props} />\n}\n\nfunction AlertDialogTrigger({ ...props }: AlertDialogPrimitive.Trigger.Props) {\n  return (\n    <AlertDialogPrimitive.Trigger data-slot=\"alert-dialog-trigger\" {...props} />\n  )\n}\n\nfunction AlertDialogPortal({ ...props }: AlertDialogPrimitive.Portal.Props) {\n  return (\n    <AlertDialogPrimitive.Portal data-slot=\"alert-dialog-portal\" {...props} />\n  )\n}\n\nfunction AlertDialogOverlay({\n  className,\n  ...props\n}: AlertDialogPrimitive.Backdrop.Props) {\n  return (\n    <AlertDialogPrimitive.Backdrop\n      data-slot=\"alert-dialog-overlay\"\n      className={cn(\n        \"fixed inset-0 isolate z-50 bg-black/10 duration-100 supports-backdrop-filter:backdrop-blur-xs data-open:animate-in data-open:fade-in-0 data-closed:animate-out data-closed:fade-out-0\",\n        className\n      )}\n      {...props}\n    />\n  )\n}\n\nfunction AlertDialogContent({\n  className,\n  size = \"default\",\n  ...props\n}: AlertDialogPrimitive.Popup.Props & {\n  size?: \"default\" | \"sm\"\n}) {\n  return (\n    <AlertDialogPortal>\n      <AlertDialogOverlay />\n      <AlertDialogPrimitive.Popup\n        data-slot=\"alert-dialog-content\"\n        data-size={size}\n        className={cn(\n          \"group/alert-dialog-content fixed top-1/2 left-1/2 z-50 grid w-full -translate-x-1/2 -translate-y-1/2 gap-4 rounded-xl bg-popover p-4 text-popover-foreground ring-1 ring-foreground/10 duration-100 outline-none data-[size=default]:max-w-xs data-[size=sm]:max-w-xs data-[size=default]:sm:max-w-sm data-open:animate-in data-open:fade-in-0 data-open:zoom-in-95 data-closed:animate-out data-closed:fade-out-0 data-closed:zoom-out-95\",\n          className\n        )}\n        {...props}\n      />\n    </AlertDialogPortal>\n  )\n}\n\nfunction AlertDialogHeader({\n  className,\n  ...props\n}: React.ComponentProps<\"div\">) {\n  return (\n    <div\n      data-slot=\"alert-dialog-header\"\n      className={cn(\n        \"grid grid-rows-[auto_1fr] place-items-center gap-1.5 text-center has-data-[slot=alert-dialog-media]:grid-rows-[auto_auto_1fr] has-data-[slot=alert-dialog-media]:gap-x-4 sm:group-data-[size=default]/alert-dialog-content:place-items-start sm:group-data-[size=default]/alert-dialog-content:text-left sm:group-data-[size=default]/alert-dialog-content:has-data-[slot=alert-dialog-media]:grid-rows-[auto_1fr]\",\n        className\n      )}\n      {...props}\n    />\n  )\n}\n\nfunction AlertDialogFooter({\n  className,\n  ...props\n}: React.ComponentProps<\"div\">) {\n  return (\n    <div\n      data-slot=\"alert-dialog-footer\"\n      className={cn(\n        \"-mx-4 -mb-4 flex flex-col-reverse gap-2 rounded-b-xl border-t bg-muted/50 p-4 group-data-[size=sm]/alert-dialog-content:grid group-data-[size=sm]/alert-dialog-content:grid-cols-2 sm:flex-row sm:justify-end\",\n        className\n      )}\n      {...props}\n    />\n  )\n}\n\nfunction AlertDialogMedia({\n  className,\n  ...props\n}: React.ComponentProps<\"div\">) {\n  return (\n    <div\n      data-slot=\"alert-dialog-media\"\n      className={cn(\n        \"mb-2 inline-flex size-10 items-center justify-center rounded-md bg-muted sm:group-data-[size=default]/alert-dialog-content:row-span-2 *:[svg:not([class*='size-'])]:size-6\",\n        className\n      )}\n      {...props}\n    />\n  )\n}\n\nfunction AlertDialogTitle({\n  className,\n  ...props\n}: React.ComponentProps<typeof AlertDialogPrimitive.Title>) {\n  return (\n    <AlertDialogPrimitive.Title\n      data-slot=\"alert-dialog-title\"\n      className={cn(\n        \"cn-font-heading text-base font-medium sm:group-data-[size=default]/alert-dialog-content:group-has-data-[slot=alert-dialog-media]/alert-dialog-content:col-start-2\",\n        className\n      )}\n      {...props}\n    />\n  )\n}\n\nfunction AlertDialogDescription({\n  className,\n  ...props\n}: React.ComponentProps<typeof AlertDialogPrimitive.Description>) {\n  return (\n    <AlertDialogPrimitive.Description\n      data-slot=\"alert-dialog-description\"\n      className={cn(\n        \"text-sm text-balance text-muted-foreground md:text-pretty *:[a]:underline *:[a]:underline-offset-3 *:[a]:hover:text-foreground\",\n        className\n      )}\n      {...props}\n    />\n  )\n}\n\nfunction AlertDialogAction({\n  className,\n  ...props\n}: React.ComponentProps<typeof Button>) {\n  return (\n    <Button\n      data-slot=\"alert-dialog-action\"\n      className={cn(className)}\n      {...props}\n    />\n  )\n}\n\nfunction AlertDialogCancel({\n  className,\n  variant = \"outline\",\n  size = \"default\",\n  ...props\n}: AlertDialogPrimitive.Close.Props &\n  Pick<React.ComponentProps<typeof Button>, \"variant\" | \"size\">) {\n  return (\n    <AlertDialogPrimitive.Close\n      data-slot=\"alert-dialog-cancel\"\n      className={cn(className)}\n      render={<Button variant={variant} size={size} />}\n      {...props}\n    />\n  )\n}\n\nexport {\n  AlertDialog,\n  AlertDialogAction,\n  AlertDialogCancel,\n  AlertDialogContent,\n  AlertDialogDescription,\n  AlertDialogFooter,\n  AlertDialogHeader,\n  AlertDialogMedia,\n  AlertDialogOverlay,\n  AlertDialogPortal,\n  AlertDialogTitle,\n  AlertDialogTrigger,\n}\n",
      "type": "registry:ui"
    }
  ],
  "meta": {
    "links": {
      "docs": "https://ui.shadcn.com/docs/components/base/alert-dialog",
      "examples": "https://raw.githubusercontent.com/shadcn-ui/ui/refs/heads/main/apps/v4/registry/bases/base/examples/alert-dialog-example.tsx",
      "api": "https://base-ui.com/react/components/alert-dialog.md"
    }
  },
  "type": "registry:ui"
}