{
  "$schema": "https://ui.shadcn.com/schema/registry-item.json",
  "name": "carousel",
  "dependencies": [
    "embla-carousel-react"
  ],
  "registryDependencies": [
    "button"
  ],
  "files": [
    {
      "path": "registry/radix-maia/ui/carousel.tsx",
      "content": "\"use client\"\n\nimport * as React from \"react\"\nimport useEmblaCarousel, {\n  type UseEmblaCarouselType,\n} from \"embla-carousel-react\"\n\nimport { cn } from \"@/registry/radix-maia/lib/utils\"\nimport { Button } from \"@/registry/radix-maia/ui/button\"\nimport { IconPlaceholder } from \"@/app/(create)/components/icon-placeholder\"\n\ntype CarouselApi = UseEmblaCarouselType[1]\ntype UseCarouselParameters = Parameters<typeof useEmblaCarousel>\ntype CarouselOptions = UseCarouselParameters[0]\ntype CarouselPlugin = UseCarouselParameters[1]\n\ntype CarouselProps = {\n  opts?: CarouselOptions\n  plugins?: CarouselPlugin\n  orientation?: \"horizontal\" | \"vertical\"\n  setApi?: (api: CarouselApi) => void\n}\n\ntype CarouselContextProps = {\n  carouselRef: ReturnType<typeof useEmblaCarousel>[0]\n  api: ReturnType<typeof useEmblaCarousel>[1]\n  scrollPrev: () => void\n  scrollNext: () => void\n  canScrollPrev: boolean\n  canScrollNext: boolean\n} & CarouselProps\n\nconst CarouselContext = React.createContext<CarouselContextProps | null>(null)\n\nfunction useCarousel() {\n  const context = React.useContext(CarouselContext)\n\n  if (!context) {\n    throw new Error(\"useCarousel must be used within a <Carousel />\")\n  }\n\n  return context\n}\n\nfunction Carousel({\n  orientation = \"horizontal\",\n  opts,\n  setApi,\n  plugins,\n  className,\n  children,\n  ...props\n}: React.ComponentProps<\"div\"> & CarouselProps) {\n  const [carouselRef, api] = useEmblaCarousel(\n    {\n      ...opts,\n      axis: orientation === \"horizontal\" ? \"x\" : \"y\",\n    },\n    plugins\n  )\n  const [canScrollPrev, setCanScrollPrev] = React.useState(false)\n  const [canScrollNext, setCanScrollNext] = React.useState(false)\n\n  const onSelect = React.useCallback((api: CarouselApi) => {\n    if (!api) return\n    setCanScrollPrev(api.canScrollPrev())\n    setCanScrollNext(api.canScrollNext())\n  }, [])\n\n  const scrollPrev = React.useCallback(() => {\n    api?.scrollPrev()\n  }, [api])\n\n  const scrollNext = React.useCallback(() => {\n    api?.scrollNext()\n  }, [api])\n\n  const handleKeyDown = React.useCallback(\n    (event: React.KeyboardEvent<HTMLDivElement>) => {\n      if (event.key === \"ArrowLeft\") {\n        event.preventDefault()\n        scrollPrev()\n      } else if (event.key === \"ArrowRight\") {\n        event.preventDefault()\n        scrollNext()\n      }\n    },\n    [scrollPrev, scrollNext]\n  )\n\n  React.useEffect(() => {\n    if (!api || !setApi) return\n    setApi(api)\n  }, [api, setApi])\n\n  React.useEffect(() => {\n    if (!api) return\n    onSelect(api)\n    api.on(\"reInit\", onSelect)\n    api.on(\"select\", onSelect)\n\n    return () => {\n      api?.off(\"select\", onSelect)\n    }\n  }, [api, onSelect])\n\n  return (\n    <CarouselContext.Provider\n      value={{\n        carouselRef,\n        api: api,\n        opts,\n        orientation:\n          orientation || (opts?.axis === \"y\" ? \"vertical\" : \"horizontal\"),\n        scrollPrev,\n        scrollNext,\n        canScrollPrev,\n        canScrollNext,\n      }}\n    >\n      <div\n        onKeyDownCapture={handleKeyDown}\n        className={cn(\"relative\", className)}\n        role=\"region\"\n        aria-roledescription=\"carousel\"\n        data-slot=\"carousel\"\n        {...props}\n      >\n        {children}\n      </div>\n    </CarouselContext.Provider>\n  )\n}\n\nfunction CarouselContent({ className, ...props }: React.ComponentProps<\"div\">) {\n  const { carouselRef, orientation } = useCarousel()\n\n  return (\n    <div\n      ref={carouselRef}\n      className=\"overflow-hidden\"\n      data-slot=\"carousel-content\"\n    >\n      <div\n        className={cn(\n          \"flex\",\n          orientation === \"horizontal\" ? \"-ml-4\" : \"-mt-4 flex-col\",\n          className\n        )}\n        {...props}\n      />\n    </div>\n  )\n}\n\nfunction CarouselItem({ className, ...props }: React.ComponentProps<\"div\">) {\n  const { orientation } = useCarousel()\n\n  return (\n    <div\n      role=\"group\"\n      aria-roledescription=\"slide\"\n      data-slot=\"carousel-item\"\n      className={cn(\n        \"min-w-0 shrink-0 grow-0 basis-full\",\n        orientation === \"horizontal\" ? \"pl-4\" : \"pt-4\",\n        className\n      )}\n      {...props}\n    />\n  )\n}\n\nfunction CarouselPrevious({\n  className,\n  variant = \"outline\",\n  size = \"icon-sm\",\n  ...props\n}: React.ComponentProps<typeof Button>) {\n  const { orientation, scrollPrev, canScrollPrev } = useCarousel()\n\n  return (\n    <Button\n      data-slot=\"carousel-previous\"\n      variant={variant}\n      size={size}\n      className={cn(\n        \"absolute touch-manipulation rounded-full\",\n        orientation === \"horizontal\"\n          ? \"top-1/2 -left-12 -translate-y-1/2\"\n          : \"-top-12 left-1/2 -translate-x-1/2 rotate-90\",\n        className\n      )}\n      disabled={!canScrollPrev}\n      onClick={scrollPrev}\n      {...props}\n    >\n      <IconPlaceholder\n        lucide=\"ChevronLeftIcon\"\n        tabler=\"IconChevronLeft\"\n        hugeicons=\"ArrowLeft01Icon\"\n        phosphor=\"CaretLeftIcon\"\n        remixicon=\"RiArrowLeftSLine\"\n        className=\"cn-rtl-flip\"\n      />\n      <span className=\"sr-only\">Previous slide</span>\n    </Button>\n  )\n}\n\nfunction CarouselNext({\n  className,\n  variant = \"outline\",\n  size = \"icon-sm\",\n  ...props\n}: React.ComponentProps<typeof Button>) {\n  const { orientation, scrollNext, canScrollNext } = useCarousel()\n\n  return (\n    <Button\n      data-slot=\"carousel-next\"\n      variant={variant}\n      size={size}\n      className={cn(\n        \"absolute touch-manipulation rounded-full\",\n        orientation === \"horizontal\"\n          ? \"top-1/2 -right-12 -translate-y-1/2\"\n          : \"-bottom-12 left-1/2 -translate-x-1/2 rotate-90\",\n        className\n      )}\n      disabled={!canScrollNext}\n      onClick={scrollNext}\n      {...props}\n    >\n      <IconPlaceholder\n        lucide=\"ChevronRightIcon\"\n        tabler=\"IconChevronRight\"\n        hugeicons=\"ArrowRight01Icon\"\n        phosphor=\"CaretRightIcon\"\n        remixicon=\"RiArrowRightSLine\"\n        className=\"cn-rtl-flip\"\n      />\n      <span className=\"sr-only\">Next slide</span>\n    </Button>\n  )\n}\n\nexport {\n  type CarouselApi,\n  Carousel,\n  CarouselContent,\n  CarouselItem,\n  CarouselPrevious,\n  CarouselNext,\n  useCarousel,\n}\n",
      "type": "registry:ui"
    }
  ],
  "meta": {
    "links": {
      "docs": "https://ui.shadcn.com/docs/components/radix/carousel",
      "examples": "https://raw.githubusercontent.com/shadcn-ui/ui/refs/heads/main/apps/v4/registry/bases/radix/examples/carousel-example.tsx",
      "api": "https://www.embla-carousel.com/get-started/react"
    }
  },
  "type": "registry:ui"
}