{
  "$schema": "https://ui.shadcn.com/schema/registry-item.json",
  "name": "table",
  "files": [
    {
      "path": "registry/radix-mira/ui/table.tsx",
      "content": "\"use client\"\n\nimport * as React from \"react\"\n\nimport { cn } from \"@/registry/radix-mira/lib/utils\"\n\nfunction Table({ className, ...props }: React.ComponentProps<\"table\">) {\n  return (\n    <div\n      data-slot=\"table-container\"\n      className=\"relative w-full overflow-x-auto\"\n    >\n      <table\n        data-slot=\"table\"\n        className={cn(\"w-full caption-bottom text-xs\", className)}\n        {...props}\n      />\n    </div>\n  )\n}\n\nfunction TableHeader({ className, ...props }: React.ComponentProps<\"thead\">) {\n  return (\n    <thead\n      data-slot=\"table-header\"\n      className={cn(\"[&_tr]:border-b\", className)}\n      {...props}\n    />\n  )\n}\n\nfunction TableBody({ className, ...props }: React.ComponentProps<\"tbody\">) {\n  return (\n    <tbody\n      data-slot=\"table-body\"\n      className={cn(\"[&_tr:last-child]:border-0\", className)}\n      {...props}\n    />\n  )\n}\n\nfunction TableFooter({ className, ...props }: React.ComponentProps<\"tfoot\">) {\n  return (\n    <tfoot\n      data-slot=\"table-footer\"\n      className={cn(\n        \"border-t bg-muted/50 font-medium [&>tr]:last:border-b-0\",\n        className\n      )}\n      {...props}\n    />\n  )\n}\n\nfunction TableRow({ className, ...props }: React.ComponentProps<\"tr\">) {\n  return (\n    <tr\n      data-slot=\"table-row\"\n      className={cn(\n        \"border-b transition-colors hover:bg-muted/50 data-[state=selected]:bg-muted\",\n        className\n      )}\n      {...props}\n    />\n  )\n}\n\nfunction TableHead({ className, ...props }: React.ComponentProps<\"th\">) {\n  return (\n    <th\n      data-slot=\"table-head\"\n      className={cn(\n        \"h-10 px-2 text-left align-middle font-medium whitespace-nowrap text-foreground [&:has([role=checkbox])]:pr-0\",\n        className\n      )}\n      {...props}\n    />\n  )\n}\n\nfunction TableCell({ className, ...props }: React.ComponentProps<\"td\">) {\n  return (\n    <td\n      data-slot=\"table-cell\"\n      className={cn(\n        \"p-2 align-middle whitespace-nowrap [&:has([role=checkbox])]:pr-0\",\n        className\n      )}\n      {...props}\n    />\n  )\n}\n\nfunction TableCaption({\n  className,\n  ...props\n}: React.ComponentProps<\"caption\">) {\n  return (\n    <caption\n      data-slot=\"table-caption\"\n      className={cn(\"mt-4 text-xs text-muted-foreground\", className)}\n      {...props}\n    />\n  )\n}\n\nexport {\n  Table,\n  TableHeader,\n  TableBody,\n  TableFooter,\n  TableHead,\n  TableRow,\n  TableCell,\n  TableCaption,\n}\n",
      "type": "registry:ui"
    }
  ],
  "meta": {
    "links": {
      "docs": "https://ui.shadcn.com/docs/components/radix/table",
      "examples": "https://raw.githubusercontent.com/shadcn-ui/ui/refs/heads/main/apps/v4/registry/bases/radix/examples/table-example.tsx"
    }
  },
  "type": "registry:ui"
}