{
  "$schema": "https://ui.shadcn.com/schema/registry-item.json",
  "name": "item",
  "registryDependencies": [
    "separator"
  ],
  "files": [
    {
      "path": "registry/base-nova/ui/item.tsx",
      "content": "import * as React from \"react\"\nimport { mergeProps } from \"@base-ui/react/merge-props\"\nimport { useRender } from \"@base-ui/react/use-render\"\nimport { cva, type VariantProps } from \"class-variance-authority\"\n\nimport { cn } from \"@/registry/base-nova/lib/utils\"\nimport { Separator } from \"@/registry/base-nova/ui/separator\"\n\nfunction ItemGroup({ className, ...props }: React.ComponentProps<\"div\">) {\n  return (\n    <div\n      role=\"list\"\n      data-slot=\"item-group\"\n      className={cn(\n        \"group/item-group flex w-full flex-col gap-4 has-data-[size=sm]:gap-2.5 has-data-[size=xs]:gap-2\",\n        className\n      )}\n      {...props}\n    />\n  )\n}\n\nfunction ItemSeparator({\n  className,\n  ...props\n}: React.ComponentProps<typeof Separator>) {\n  return (\n    <Separator\n      data-slot=\"item-separator\"\n      orientation=\"horizontal\"\n      className={cn(\"my-2\", className)}\n      {...props}\n    />\n  )\n}\n\nconst itemVariants = cva(\n  \"group/item flex w-full flex-wrap items-center rounded-lg border text-sm transition-colors duration-100 outline-none focus-visible:border-ring focus-visible:ring-[3px] focus-visible:ring-ring/50 [a]:transition-colors [a]:hover:bg-muted\",\n  {\n    variants: {\n      variant: {\n        default: \"border-transparent\",\n        outline: \"border-border\",\n        muted: \"border-transparent bg-muted/50\",\n      },\n      size: {\n        default: \"gap-2.5 px-3 py-2.5\",\n        sm: \"gap-2.5 px-3 py-2.5\",\n        xs: \"gap-2 px-2.5 py-2 in-data-[slot=dropdown-menu-content]:p-0\",\n      },\n    },\n    defaultVariants: {\n      variant: \"default\",\n      size: \"default\",\n    },\n  }\n)\n\nfunction Item({\n  className,\n  variant = \"default\",\n  size = \"default\",\n  render,\n  ...props\n}: useRender.ComponentProps<\"div\"> & VariantProps<typeof itemVariants>) {\n  return useRender({\n    defaultTagName: \"div\",\n    props: mergeProps<\"div\">(\n      {\n        className: cn(itemVariants({ variant, size, className })),\n      },\n      props\n    ),\n    render,\n    state: {\n      slot: \"item\",\n      variant,\n      size,\n    },\n  })\n}\n\nconst itemMediaVariants = cva(\n  \"flex shrink-0 items-center justify-center gap-2 group-has-data-[slot=item-description]/item:translate-y-0.5 group-has-data-[slot=item-description]/item:self-start [&_svg]:pointer-events-none\",\n  {\n    variants: {\n      variant: {\n        default: \"bg-transparent\",\n        icon: \"[&_svg:not([class*='size-'])]:size-4\",\n        image:\n          \"size-10 overflow-hidden rounded-sm group-data-[size=sm]/item:size-8 group-data-[size=xs]/item:size-6 [&_img]:size-full [&_img]:object-cover\",\n      },\n    },\n    defaultVariants: {\n      variant: \"default\",\n    },\n  }\n)\n\nfunction ItemMedia({\n  className,\n  variant = \"default\",\n  ...props\n}: React.ComponentProps<\"div\"> & VariantProps<typeof itemMediaVariants>) {\n  return (\n    <div\n      data-slot=\"item-media\"\n      data-variant={variant}\n      className={cn(itemMediaVariants({ variant, className }))}\n      {...props}\n    />\n  )\n}\n\nfunction ItemContent({ className, ...props }: React.ComponentProps<\"div\">) {\n  return (\n    <div\n      data-slot=\"item-content\"\n      className={cn(\n        \"flex flex-1 flex-col gap-1 group-data-[size=xs]/item:gap-0 [&+[data-slot=item-content]]:flex-none\",\n        className\n      )}\n      {...props}\n    />\n  )\n}\n\nfunction ItemTitle({ className, ...props }: React.ComponentProps<\"div\">) {\n  return (\n    <div\n      data-slot=\"item-title\"\n      className={cn(\n        \"cn-font-heading line-clamp-1 flex w-fit items-center gap-2 text-sm leading-snug font-medium underline-offset-4\",\n        className\n      )}\n      {...props}\n    />\n  )\n}\n\nfunction ItemDescription({ className, ...props }: React.ComponentProps<\"p\">) {\n  return (\n    <p\n      data-slot=\"item-description\"\n      className={cn(\n        \"line-clamp-2 text-left text-sm leading-normal font-normal text-muted-foreground group-data-[size=xs]/item:text-xs [&>a]:underline [&>a]:underline-offset-4 [&>a:hover]:text-primary\",\n        className\n      )}\n      {...props}\n    />\n  )\n}\n\nfunction ItemActions({ className, ...props }: React.ComponentProps<\"div\">) {\n  return (\n    <div\n      data-slot=\"item-actions\"\n      className={cn(\"flex items-center gap-2\", className)}\n      {...props}\n    />\n  )\n}\n\nfunction ItemHeader({ className, ...props }: React.ComponentProps<\"div\">) {\n  return (\n    <div\n      data-slot=\"item-header\"\n      className={cn(\n        \"flex basis-full items-center justify-between gap-2\",\n        className\n      )}\n      {...props}\n    />\n  )\n}\n\nfunction ItemFooter({ className, ...props }: React.ComponentProps<\"div\">) {\n  return (\n    <div\n      data-slot=\"item-footer\"\n      className={cn(\n        \"flex basis-full items-center justify-between gap-2\",\n        className\n      )}\n      {...props}\n    />\n  )\n}\n\nexport {\n  Item,\n  ItemMedia,\n  ItemContent,\n  ItemActions,\n  ItemGroup,\n  ItemSeparator,\n  ItemTitle,\n  ItemDescription,\n  ItemHeader,\n  ItemFooter,\n}\n",
      "type": "registry:ui"
    }
  ],
  "meta": {
    "links": {
      "docs": "https://ui.shadcn.com/docs/components/base/item",
      "examples": "https://raw.githubusercontent.com/shadcn-ui/ui/refs/heads/main/apps/v4/registry/bases/base/examples/item-example.tsx"
    }
  },
  "type": "registry:ui"
}