{
  "$schema": "https://ui.shadcn.com/schema/registry-item.json",
  "name": "font-heading-ibm-plex-sans",
  "title": "IBM Plex Sans (Heading)",
  "type": "registry:font",
  "font": {
    "family": "'IBM Plex Sans Variable', sans-serif",
    "provider": "google",
    "import": "IBM_Plex_Sans",
    "variable": "--font-heading",
    "subsets": [
      "latin"
    ],
    "dependency": "@fontsource-variable/ibm-plex-sans"
  }
}